<?xml version="1.0" encoding="UTF-8"?>
<collection xmlns:xsi="http://www.w3.org/2001/XMLSchema-instance"
            xsi:schemaLocation="xmlSchema.xsd">
    <employee>
        <name>Petya</name>
        <age>25</age>
        <salary>700</salary>
        <qualification>middle</qualification>
    </employee>

    <employee>
        <name>Vasya</name>
        <age>19</age>
        <salary>850</salary>
    </employee>

    <employee>
        <name>Vanya</name>
        <age>32</age>
        <salary>1300</salary>
    </employee>

    <employee>
        <name>Max</name>
        <age>23</age>
        <salary>600</salary>
        <qualification>junior</qualification>
    </employee>
</collection>